Section,Product,Price,Discount,Rating
Accessories,Blubby Multi Clutcher ( Pack of 1 ),213,79,2.7
Accessories,Ezybe Self Adhesive Kichen Shelf Light Blue Plastic Storage Racks (Pack of 2),173,83,2.7
Accessories,AUTOGROOMZ Windshield Only Double Clamp Car Mobile Holder - Black,217,82,2.3
Accessories,QitmirMKT NEW KEYCHAIN LIGHTER WITH HIGH POWER LIGHT Multicolor Multipurpose Car Cigarette Lighter ( Pack of 1 ),238,76,4.4
Accessories,"Portronics Clamp M3 Adjustable Car Mobile Phone Holder Stand for Dashboard & Windshield, 360degree Rotational, Strong Suction Cup, Compatible with 4 to 6 inch Devices(Black)",268,70,3.6
Accessories,CRAYLUXE Accu Pressure Bead Back / Lumbar Support Single Black,538,64,2.8
Accessories,"delhideals Indian Flag for Car Dashboard, Office Table, Study Table & Drawing Table",195,67,2.8
Accessories,"5 In 1 Multi Pin Universal Portable Adapter And Car Mobile Charging Cable For (iPhone,Type C and Micro USB)",254,75,3.9
Accessories,"Aksmit Pack of -1 Car Gear Knob Protector Gear Shifter Cover for Anti-Scratch Car Gear Knob Cover and Dust Proof Nonslip Gear Cover for Car Universal Fit Silicon Car Gear Knob Stylish- Black, Silicone Rubber",187,53,3.1
Accessories,GEEO Accu Pressure Bead Back / Lumbar Support Single Black,223,78,4.2
Accessories,Vertical9 Car Mobile Charger 3_in_1 cable Multicolour,240,78,2.1
Accessories,"Aksmit Waterproof and Non-slip Leather Floor Mats, Car Floor Mat Accessories, Black gold",1472,13,4.2
Accessories,Tender care Memory Foam Back / Lumbar Support Single Black,350,77,3.3
Accessories,AKSMIT Dashboard Fan Black,508,27,4.4
Accessories,Aksmit 4 Pieces 12 LED DC 12V Multicolour Music Car Strip Atmosphere Lamp Light for Car Interior Under Dash Lighting Kit with Sound Active Function and Wireless Control,338,52,3.8
Accessories,Aksmit Premium Metal Key Cover Compitable for Maruti Suzuki Ignis,434,57,3.6
Accessories,JAGIRA DIVINE TOUCH Multicolor Plastic Storage Racks ( Pack of 1 ),116,83,4.7
Accessories,Digital Car Dashboard Alarm Clock and Stopwatch With Flexible Stand,180,55,4.5
Accessories,RONISH Neck Cushions Set of 2 Black,160,68,2.9
Accessories,"GEEO Universal Car Steering Knob, Car Steering Wheel Knob, Steering Wheel Spinner Knob, 360° Rotation Booster (3R Original)",331,67,2.7
Accessories,Anshri White Plastic Storage Racks ( Pack of 4 ),250,75,2.3
Accessories,Blubby Multi Rubber Band ( Pack of 30 ),135,83,2.5
Accessories,RONISH Steering Cover Leatherite,395,60,4.1
Accessories,mahek accessories for Headrest Black,137,86,4.2
Accessories,Sonal Brown Plastic Storage Racks ( Pack of 1 ),500,38,2.3
Accessories,"TANTRA Car Armrest Cover Cushion with 2 Storage Bags - Soft, Comfortable, Non-Slip Protector for Vehicle Center Console - Waterproof, Durable, and Stylish",365,63,2.4
Accessories,"TANTRA Car Armrest Cover Cushion with 2 Storage Bags - Soft, Comfortable, Non-Slip Protector for Vehicle Center Console - Waterproof, Durable, and Stylish",365,63,4.0
Accessories,Anshri White Plastic Kitchen Dispenser ( Pack of 2 ),167,67,2.1
Accessories,Winstar - Silver Stainless Steel Wall mount Stand ( Pack of 1 ),790,74,3.1
Accessories,12 LED Multicolor Music Controlled Sound Activated for Car Interior Atmosphere Light (Works with All Cars) Pack Of-1,351,50,4.2
Accessories,AKSMIT Dashboard Fan Black,586,27,4.4
Accessories,"48Inch Ice Blue & Red DRL LED Brake with Side Turn Signal & Parking Indication Trunk,Boot,Dicky Light For Innova 2005-12",388,61,3.8
Accessories,"Premium Car Seat Belt Cover - Comfort & Safety Enhancer - Adjustable, Soft, & Stylish - Universal Fit for All Vehicles",278,72,2.5
Accessories,4 Color 17 CM DRL Strip,187,63,3.8
Accessories,Bhavyta Night Vision Visor Plastic Yellow,441,56,4.7
Accessories,CarFrill Gear Knob Silicone for 5 Speed Gear,288,64,4.3
Accessories,SWASTICK Black Stainless Steel Storage Racks ( Pack of 2 ),281,77,2.3
Accessories,CarFrill Gear Knob Metallic for 5 Speed Gear,588,41,3.3
Accessories,"4pcs Universal Fit Magnetic Car Side Window Curtains, Foldable Car Window Privacy Curtains Sunshade Side Magnet Pleated - Removable - Keeps Cooler Screen for Baby (Car Curtain-Black)",669,44,3.6
Accessories,"Car Sunshade Windshield Cover, Umbrella Windshield Sunshade for Car Front Window Sun Protection & Heat Insulation Foldable Sun Shade Full Cover Sunshade for Most Vehicles,",327,67,4.2
Accessories,Rhosyn Gold Women's Hair Clip ( Pack of 1 ),183,63,2.6
Accessories,KP Mart Electronic Kitchen Digital Weighing Scale Multipurpose 10 Kg (SF 400A),626,37,3.9
Accessories,"Portronics Car Power 5 Car Charger with Dual USB Ports ,Black (POR 1345) wihtout cable",204,59,3.2
Accessories,RONISH Steering Cover Leatherite,446,55,2.6
Accessories,star light for car interior,233,77,3.0
Accessories,"Portronics 51W Car Power 16 Fast Car Charger with Dual Output, 51 Watts Total (18W USB + 33W Type C PD), Fast Charging, Adapter for iPhone & Android Smartphones and Tablets (Black)",351,65,4.6
Accessories,JVG Neck Cushions Set of 2 Black,188,62,2.2
Accessories,"Premium Metal Key Cover Compitable for Suzuki Swift|Ertiga|Wagonr|Celerio|Swift Dzire|Alto|Fronx|Breza|S Presso|Ignis 2 Button Remote Key, Brown and Black",460,42,3.0
Accessories,Crust Laptop Charger / Inverter N80 Black,1382,62,4.2
Accessories,RONISH Steering Cover Leatherite,300,62,2.8
Accessories,"Masala Rangoli Box Dabba for Keeping Spices, Spice Box for Kitchen, Plastic Wooden Style Masala Box, Masala Container, Masala Dabba",171,83,4.6
Accessories,SPIX Black Stainless Steel Storage Racks ( Pack of 2 ),262,74,3.7
Accessories,JISUN Chakla Belan Stand Silver Stainless Steel Rolling Pin Holder ( Pack of 1 ),158,68,3.7
Accessories,"KP Mart Multi Functional Makeup Storage Box with Holder Dust Proof Cosmetic Organizer Water Proof Box for Desktop Bathroom, Dresser, Vanity and Countertop Cosmetic Box Plastic",197,80,2.8
Accessories,Anshri Silver Steel Kitchen Cloth Hook ( Pack of 2 ),178,55,3.5
Accessories,"SIAGO Premium Car Keys Keychain - Durable Metal Key Holder for Cars, Bike Key Chain",361,76,2.3
Accessories,Metal Silicon Key Cover Compatible with Maruti Suzuki jimny Baleno Grand Vitara XL6 Swift New Brezza Ertiga Dzire 3 Button Smart Key Special Feature Visibilitye in Low-Ligh Conditions,434,46,3.1
Accessories,SPIX Black Stainless Steel Storage Racks ( Pack of 1 ),281,81,3.0
Accessories,Anshri Multicolor Plastic Wall mount Stand ( Pack of 2 ),159,60,3.6
Accessories,Skylii - Olive Plastic Fruit & Vegetable Trolley ( Pack of 1 ),257,74,3.7
Footwear,AROTEK Grey Men's Daily Slipper,191,76,3.2
Footwear,Xtoon Grey Men's Outdoor Shoes,498,67,3.0
Footwear,Cozy Wear Black Men's Daily Slipper,183,63,2.8
Footwear,PENNEN Green Women's Flats,270,66,2.1
Footwear,Stylestry Gray Women's Sandal Heels,518,74,3.6
Footwear,PERY PAO Blue Men's Slide Flip Flop,226,77,3.6
Footwear,Aadi Black Men's Derby Formal Shoes,452,77,3.5
Footwear,FUSEOWL Maroon Women's Flip Flop,171,83,4.0
Footwear,Cozy Wear Brown Men's Daily Slipper,193,61,4.5
Footwear,YNP Design Collections Brown Women's Ethnic Ballerinas,411,18,4.4
Footwear,Densu Black Men's Korean Shoes,597,60,2.2
Footwear,Squash Black Men's Thong Flip Flop,230,67,2.9
Footwear,hanuco Height Increasing Insoles,301,70,3.6
Footwear,ROGZI Cream Polish Suitable for Neutral Color,181,9,2.2
Footwear,Cozy Wear Olive Men's Daily Slipper,193,61,4.1
Footwear,Bersache - Light Grey Boy's Clogs ( 1 Pair ),364,82,3.0
Footwear,Citipiti ind. Green Women's Flats,208,70,3.8
Footwear,BEE U NIK Black Men's Thong Flip Flop,176,65,2.3
Footwear,Z Brown Men's Slide Flip Flop,279,65,2.5
Footwear,hanuco Orthopaedic Insoles,252,67,3.2
Footwear,lyvi Black Men's Daily Slipper,187,79,3.0
Footwear,Xtoon Multi Color Men's Korean Shoes,548,63,3.5
Footwear,LiteHawks Green Men's Daily Slipper,220,78,2.3
Footwear,Paduki Silver Women's Flats,277,60,3.0
Footwear,Dream Makers - Black Women's Sandal Heels,407,73,2.4
Footwear,Cozy Wear Black Men's Daily Slipper,214,57,3.1
Footwear,KATENIA - Black Men's Oxford Formal Shoes,528,74,3.9
Footwear,FUSEOWL Light Grey Women's Toe Covered Flip Flop,250,75,4.1
Footwear,Shoetopia Black Women's Casual Ballerinas,376,62,2.4
Footwear,Radhe Creation Cream Polish Suitable for Black Color,197,67,4.1
Footwear,ZYPSO Zypso Men?s Grey Synthetic Grey Men's Lifestyle Shoes,559,72,3.6
Footwear,WildProducts All Type Shoes Cleaner,148,85,2.8
Footwear,PENNEN White Men's Lifestyle Shoes,552,45,2.1
Footwear,HANSWING All Type Shoes Cleaner,148,81,3.5
Footwear,Campus Oxyfit (N) Navy Blue Men's Slip-on Shoes,622,38,3.6
Footwear,PENNEN White Men's Lifestyle Shoes,393,61,2.5
Footwear,Altek PeachPuff Women's Flats,244,51,3.6
Footwear,"ADISO Trendy ,outdoor stylish casual White Men's Outdoor Shoes",597,80,3.9
Footwear,Seafoot White Men's Outdoor Shoes,317,68,3.5
Footwear,Modern Stylish Latest Kids Girls And Kids Boys Clog Flip Flops,262,91,4.4
Footwear,Stylestry Silver Women's Flats,447,78,4.3
Footwear,Dream Makers - Black Women's Sandal Heels,407,73,2.1
Footwear,Rising Wolf Tan Men's Derby Formal Shoes,600,80,3.8
Footwear,FUSEOWL Purple Women's Toe Covered Flip Flop,278,72,3.6
Footwear,KARADDI Brown Women's Formal Ballerinas,438,78,3.2
Footwear,BHAVYTA COSMETIC Cream Polish Suitable for White Color,160,82,4.4
Footwear,ROGZI Liquid Polish Suitable for Black Color,253,15,2.8
Footwear,Paduki Gray Women's Flats,308,56,2.8
Footwear,Citipiti ind. Gray Women's Flats,208,70,2.5
Footwear,MAAN Black Women's Gladiators Flats,216,78,2.8
Footwear,PENNEN Blue Women's Flats,270,66,2.7
Footwear,Paduki Gold Women's Flats,280,60,2.6
Footwear,Altek Silver Women's Flats,296,70,4.6
Footwear,Prolific - Black Men's Driving loafers,738,69,2.6
Footwear,KHADIM Beige Flats,480,31,2.5
Footwear,Paduki White Women's Flats,332,53,2.8
Footwear,Altek Peach Women's Flats,263,74,4.1
Footwear,PM Traders Black Women's Flats,406,59,3.1
Footwear,IKAGI Brown Women's Flats,474,76,3.2
Footwear,HANSWING Liquid Polish Suitable for Neutral Color,259,48,3.4
Kids Fashion,Cool and NIce kids Multi color Bermuda pack of 5,341,43,4.2
Kids Fashion,"A.W.A KIDS FASHION Cotton Frock For Girls ( Pack of 1 , Blue )",382,45,2.2
Kids Fashion,"A.W.A KIDS FASHION Cotton Blend Frock For Girls ( Pack of 1 , Pink )",382,62,3.7
Kids Fashion,"A.W.A KIDS FASHION Cotton Blend Frock For Girls ( Pack of 1 , Light Blue )",382,62,2.5
Kids Fashion,"Villata fashion Net Frock For Girls ( Pack of 1 , White )",275,72,3.0
Kids Fashion,"Arshia Fashions Girls Cotton Blend Kurti with Sharara ( Pack of 1 , Pink )",561,84,3.8
Kids Fashion,"Arshia Fashions Cotton Blend Shirt Dress For Girls ( Pack of 1 , Blue )",501,75,2.7
Kids Fashion,"Nios Fashion Girls Cotton Polyester Jeans ( Pack of 2 , Multicolor 1 )",355,61,2.7
Kids Fashion,"PMD Fashion Net Lehenga Choli Set For Girls ( Pack of 1 , Charcoal )",355,64,2.1
Kids Fashion,s muktar garments - Green Cotton Blend Boys Professional Costume ( Pack of 1 ),311,56,3.4
Kids Fashion,NI FASHION Pack of 1 Boys Cotton Blend T-Shirt ( Black ),171,66,4.3
Kids Fashion,"Villata fashion Net Frock For Girls ( Pack of 1 , Red )",290,71,3.4
Kids Fashion,"Arshia Fashions Net Lehenga Choli Set For Girls ( Pack of 1 , Green )",620,74,3.5
Kids Fashion,KASEERA CUTE STYLISH AND TRENDING KIDS GYM VEST PACK OF 5,273,61,3.0
Kids Fashion,"Arshia Fashions Polyester Shirt Dress For Girls ( Pack of 1 , Multicolor )",561,72,2.9
Kids Fashion,"Villata fashion Net Frock For Girls ( Pack of 1 , Red )",331,67,2.4
Kids Fashion,NAYPAL FASHION STYLE Pack of 1 Boys & Girls Cotton Blend T-Shirt ( Pink ),246,75,4.5
Kids Fashion,"Arshia Fashions Polyester Fit And Flare Dress For Girls ( Pack of 1 , Purple )",561,72,2.6
Kids Fashion,"Villata fashion Net Frock For Girls ( Pack of 1 , Red )",281,72,2.4
Kids Fashion,"A.W.A KIDS FASHION Cotton Blend Frock For Girls ( Pack of 1 , Red )",582,42,2.9
Kids Fashion,"Villata fashion Net Frock For Girls ( Pack of 1 , Pink )",355,64,4.3
Kids Fashion,"Arshia Fashions Girls Cotton Blend Patiala Kurta Set ( Pack of 1 , Green )",561,78,3.2
Kids Fashion,"Nios Fashion Girls Cotton Polyester Jeans ( Pack of 2 , Multicolor 4 )",355,61,3.4
Kids Fashion,NI FASHION Pack of 1 Boys Cotton Blend T-Shirt ( Green ),171,66,4.7
Kids Fashion,"PMD Fashion Net Lehenga Choli Set For Girls ( Pack of 1 , Wine )",355,64,3.1
Kids Fashion,NI FASHION Pack of 1 Boys Cotton Blend T-Shirt ( Purple ),171,66,4.2
Kids Fashion,"Villata fashion Net Frock For Girls ( Pack of 1 , Red )",331,67,2.3
Kids Fashion,NI FASHION Pack of 1 Boys Cotton Blend T-Shirt ( Maroon ),171,66,2.7
Kids Fashion,"SUBRUNG FASHION Crepe Frock For Baby Girls ( Pack of 1 , Multicolor 1 )",389,76,4.1
Kids Fashion,"Niicce Fashion Rayon Dress For Girls ( Pack of 1 , Yellow )",532,65,4.0
Kids Fashion,"Villata fashion Net Frock For Girls ( Pack of 1 , Pink )",331,67,2.4
Kids Fashion,NI FASHION Pack of 1 Boys Cotton Blend T-Shirt ( Red ),171,66,2.5
Kids Fashion,"Villata fashion Net Frock For Girls ( Pack of 1 , Sky Blue )",331,67,3.0
Kids Fashion,"PMD Fashion Net Lehenga Choli Set For Girls ( Pack of 1 , Rust )",355,64,3.5
Kids Fashion,"Villata fashion Net Frock For Girls ( Pack of 1 , White )",265,73,2.1
Kids Fashion,"Arshia Fashions Net Lehenga Choli Sets For Girls ( , Blue )",381,84,2.7
Kids Fashion,NI FASHION Pack of 1 Boys Cotton Blend T-Shirt ( Light Green ),171,66,4.1
Kids Fashion,"samjho fashion Net Gown For Girls ( Pack of 1 , Pink )",149,85,2.4
Kids Fashion,"Vidya Fashions Net Frock For Girls ( Pack of 1 , Pink )",482,63,3.5
Kids Fashion,NI FASHION Pack of 1 Boys Cotton Blend Polo T-Shirt ( White ),171,66,3.2
Kids Fashion,"Arshia Fashions Net Lehenga Choli Sets For Girls ( , Red )",381,84,3.7
Kids Fashion,"Villata fashion Net Frock For Girls ( Pack of 1 , White )",331,67,4.4
Kids Fashion,"Nios Fashion Girls Cotton Polyester Jeans ( Pack of 2 , Multicolor 2 )",355,61,3.6
Kids Fashion,NI FASHION Pack of 1 Boys Cotton Blend T-Shirt ( Sky Blue ),171,66,4.6
Kids Fashion,"A.W.A KIDS FASHION Cotton Blend Frock For Girls ( Pack of 1 , Green )",582,42,3.7
Kids Fashion,Niicce Fashion Pack of 3 Girls Georgette Frock and Trackpant ( Blue ),508,68,2.4
Kids Fashion,"Arshia Fashions Girls Cotton Blend Kurti with Sharara ( Pack of 1 , Pink )",561,80,4.3
Kids Fashion,"Villata fashion Net Frock For Girls ( Pack of 1 , Blue )",275,72,2.9
Kids Fashion,"Villata fashion Net Frock For Girls ( Pack of 1 , Red )",262,74,4.4
Kids Fashion,"Dhvra Fashion Girls Georgette Kurti with Palazzo ( Pack of 1 , BLUE )",482,52,2.6
Kids Fashion,"Villata fashion Net Frock For Girls ( Pack of 1 , Pink )",262,74,4.0
Kids Fashion,"Arshia Fashions Polyester Fit And Flare Dress For Girls ( Pack of 1 , Blue )",561,72,4.3
Kids Fashion,"samjho fashion Net Frock For Baby Girls ( Pack of 1 , Green )",320,60,3.4
Kids Fashion,"A.W.A KIDS FASHION Cotton Blend Frock For Girls ( Pack of 1 , Orange )",582,42,3.2
Kids Fashion,NI FASHION Pack of 1 Boys Cotton Blend T-Shirt ( Navy Blue ),171,66,3.7
Kids Fashion,"Villata fashion Net Frock For Girls ( Pack of 1 , Blue )",281,72,3.6
Kids Fashion,"Nios Fashion Girls Cotton Polyester Jeans ( Pack of 2 , Multicolor 3 )",355,61,2.8
Kids Fashion,"Arshia Fashions Net Frock For Girls ( Pack of 1 , Light Blue )",381,79,2.4
Kids Fashion,"A.W.A KIDS FASHION Cotton Blend Frock For Girls ( Pack of 1 , Red )",582,42,2.9
Kids Fashion,"Villata fashion Net Frock For Girls ( Pack of 1 , Pink )",290,71,4.5
Men Clothing,Mashaykh Polyester Men's Windcheater Jacket - White ( Pack of 1 ),682,66,4.1
Men Clothing,Montrez Cotton Blend Men's Casual Jacket - White ( Pack of 1 ),557,78,3.2
Men Clothing,Mashaykh Polyester Men's Windcheater Jacket - Black ( Pack of 1 ),657,67,3.4
Men Clothing,eddicted Polyester Men's Puffer Jacket - Navy Blue ( Pack of 1 ),617,53,2.6
Men Clothing,TrendsTalk Nylon Men's Windcheater Jacket - Gold ( Pack of 1 ),429,79,2.8
Men Clothing,Forbro Nylon Men's Windcheater Jacket - Black ( Pack of 1 ),598,70,2.6
Men Clothing,Montrez Cotton Blend Men's Casual Jacket - Olive ( Pack of 1 ),557,78,2.8
Men Clothing,eddicted Polyester Men's Puffer Jacket - Blue ( Pack of 1 ),582,55,4.0
Men Clothing,AZF Nylon Men's Casual Jacket - Wine ( Pack of 1 ),457,71,2.5
Men Clothing,eddicted Polyester Men's Quilted & Bomber Jacket - Maroon ( Pack of 1 ),617,53,3.8
Men Clothing,Rigo Fleece Men's Casual Jacket - Grey ( Pack of 1 ),612,74,3.6
Men Clothing,yellow tree Polyester Men's Casual Jacket - White ( Pack of 1 ),704,72,2.5
Men Clothing,AZF Nylon Men's Windcheater Jacket - Dark Grey ( Pack of 1 ),457,71,3.3
Men Clothing,yellow tree Polyester Men's Casual Jacket - Black ( Pack of 1 ),685,73,2.4
Men Clothing,eddicted Nylon Men's Biker Jacket - Grey ( Pack of 1 ),617,53,2.1
Men Clothing,yellow tree Polyester Men's Casual Jacket - Multicolor ( Pack of 1 ),722,64,4.3
Men Clothing,FTX Denim Men's Denim Jacket - Light Blue ( Pack of 1 ),557,75,4.1
Men Clothing,Rigo Polyester Men's Puffer Jacket - Grey ( Pack of 1 ),691,83,3.2
Men Clothing,TAZO Nylon Men's Windcheater Jacket - Blue ( Pack of 1 ),462,67,4.1
Men Clothing,Camey Polyester Men's Casual Jacket - Green ( Pack of 1 ),678,77,4.1
Men Clothing,Reya Cotton Blend Men's Casual Jacket - Maroon ( Pack of 1 ),429,71,4.5
Men Clothing,Mashaykh Polyester Men's Windcheater Jacket - Multicolor 2 ( Pack of 1 ),682,66,2.2
Men Clothing,Reya Cotton Blend Men's Casual Jacket - Black ( Pack of 1 ),429,71,3.6
Men Clothing,Forbro Nylon Men's Windcheater Jacket - Maroon ( Pack of 1 ),598,70,3.0
Men Clothing,Eyebogler Polyester Men's Windcheater Jacket - Grey ( Pack of 1 ),344,86,4.1
Men Clothing,AZF Nylon Men's Windcheater Jacket - Navy ( Pack of 1 ),457,71,4.4
Men Clothing,Christy World Nylon Men's Windcheater Jacket - Black ( Pack of 1 ),617,75,4.0
Men Clothing,AZF Nylon Men's Windcheater Jacket - Olive ( Pack of 1 ),457,71,2.4
Men Clothing,Forbro Nylon Men's Windcheater Jacket - White ( Pack of 1 ),598,70,4.2
Men Clothing,TrendsTalk Nylon Men's Windcheater Jacket - Blue ( Pack of 1 ),576,62,3.9
Men Clothing,AZF Nylon Men's Windcheater Jacket - Blue ( Pack of 1 ),457,71,4.6
Men Clothing,IF-INDIAN FORT Polyester Men's Quilted & Bomber Jacket - Navy ( Pack of 1 ),658,61,3.0
Men Clothing,Montrez Cotton Blend Men's Casual Jacket - Yellow ( Pack of 1 ),557,78,4.0
Men Clothing,MAYKR Polyester Men's Casual Jacket - Black ( Pack of 1 ),738,43,3.2
Men Clothing,Camey Polyester Men's Casual Jacket - Mustard ( Pack of 1 ),740,75,3.2
Men Clothing,Club York Polyester Men's Quilted & Bomber Jacket - Maroon ( Pack of 1 ),793,80,4.3
Men Clothing,FLIRTY SOUL Polyester Men's Casual Jacket - White ( Pack of 1 ),457,77,2.5
Men Clothing,NUEVOSPORTA Polyester Men's Puffer Jacket - White ( Pack of 1 ),800,80,2.9
Men Clothing,eddicted Polyester Men's Windcheater Jacket - Grey ( Pack of 1 ),617,53,2.6
Men Clothing,Reya Cotton Blend Men's Casual Jacket - Blue ( Pack of 1 ),429,71,3.9
Men Clothing,Reya Cotton Blend Men's Casual Jacket - Blue ( Pack of 1 ),429,71,3.0
Men Clothing,eddicted Polyester Men's Biker Jacket - Maroon ( Pack of 1 ),617,53,3.2
Men Clothing,yellow tree Polyester Men's Casual Jacket - White ( Pack of 1 ),704,72,2.8
Men Clothing,SCOLLER Polyester Men's Windcheater Jacket - Navy Blue ( Pack of 1 ),517,76,2.2
Men Clothing,Camey Polyester Men's Casual Jacket - Red ( Pack of 1 ),701,77,3.6
Men Clothing,eddicted Polyester Men's Biker Jacket - Maroon ( Pack of 1 ),617,53,2.6
Men Clothing,Christy World Polyester Men's Casual Jacket - White ( Pack of 1 ),535,79,2.3
Men Clothing,Dollar Polyester Men's Windcheater Jacket - Navy ( Pack of 1 ),750,50,2.3
Men Clothing,SCOLLER Polyester Men's Windcheater Jacket - Olive ( Pack of 1 ),517,76,4.0
Men Clothing,TAZO Nylon Men's Casual Jacket - Grey ( Pack of 1 ),490,65,4.2
Men Clothing,Dollar Nylon Men's Casual Jacket - Black ( Pack of 1 ),753,47,4.6
Men Clothing,TrendsTalk Nylon Men's Windcheater Jacket - Black ( Pack of 1 ),429,79,2.8
Men Clothing,THECLASSICTOGS Polyester Men's Windcheater Jacket - Grey ( Pack of 2 ),547,58,2.8
Men Clothing,TAZO Nylon Men's Windcheater Jacket - Light Grey ( Pack of 1 ),462,67,2.9
Men Clothing,Leotude Fleece Men's Casual Jacket - Grey ( Pack of 1 ),529,67,3.3
Men Clothing,eddicted Polyester Men's Biker Jacket - Navy Blue ( Pack of 1 ),617,53,4.5
Men Clothing,MAYKR Polyester Men's Windcheater Jacket - Grey ( Pack of 1 ),774,61,3.9
Men Clothing,eddicted Polyester Men's Biker Jacket - Grey ( Pack of 1 ),617,53,3.0
Men Clothing,Rigo Fleece Men's Casual Jacket - Olive ( Pack of 1 ),482,80,3.5
Men Clothing,TAZO Nylon Men's Casual Jacket - Grey ( Pack of 1 ),424,70,4.5
Women Clothing,Sheetal associates Women Polyester Printed Fit & Flare Dress ( Blue ),394,61,3.5
Women Clothing,wanquila Women Lycra Solid Bodycon Dress ( Beige ),363,85,2.1
Women Clothing,"BLYNK Lycra Petticoat ( Maroon , )",171,87,3.9
Women Clothing,Sheetal associates Women Crepe Printed A-line Dress ( Orange ),339,66,3.0
Women Clothing,TUHIRAJ Women Crepe Printed Gown ( Brown ),470,53,4.3
Women Clothing,Sheetal associates Women Polyester Printed Fit & Flare Dress ( Brown ),394,61,2.8
Women Clothing,"KNOWZY Rayon Women Dupatta ( Magenta , Pack of 1 )",108,82,2.9
Women Clothing,Fabverse Women Lycra Solid Bodycon Dress ( Black ),319,79,3.5
Women Clothing,Sheetal associates Women Crepe Printed Fit & Flare Dress ( White ),394,61,3.4
Women Clothing,THE LADIES FASHION Women Viscose Rayon Maxi ( White ),391,76,2.1
Women Clothing,Sheetal associates Women Crepe Printed Shirt Dress ( Green ),394,61,2.4
Women Clothing,NIVESTANA Women Viscose Rayon Gown ( Purple ),393,75,3.3
Women Clothing,Madhusudan Women Rayon Printed Ethnic Dress ( Pink ),452,76,3.2
Women Clothing,"DELTIN HUB Polyester Petticoat ( Blue , )",234,67,3.2
Women Clothing,Honky Tonky Women Polyester Self Design A-line Dress ( Pink ),382,62,3.2
Women Clothing,Sheetal associates Women Crepe Printed Shirt Dress ( White ),394,61,3.4
Women Clothing,Sheetal associates Women Crepe Printed A-line Dress ( White ),394,61,2.3
Women Clothing,JASH CREATION Women Cotton Blend Printed Fit & Flare Dress ( Pink ),356,82,2.2
Women Clothing,Fasanger Cotton Lycra Women's Shrugs - White ( ),244,90,2.9
Women Clothing,Shri Hub Cotton Women White Salwar,220,63,3.9
Women Clothing,"BLYNK Lycra Petticoat ( Pink , )",171,87,4.5
Women Clothing,"DELTIN HUB Polyester Petticoat ( White , )",234,67,2.2
Women Clothing,Fasanger Cotton Lycra Women's Shrugs - Blue ( ),281,89,3.2
Women Clothing,MAYRAAFASHION Net Self Design Regular Saree With Unstitched Blouse Piece ( Pink ),448,70,3.7
Women Clothing,"TAMINA Black,White Cotton Blend Women's Flared Skirt ( Pack of 1 )",332,78,3.8
Women Clothing,shrihub - Cotton Red Women's Semi Patiala Salwar ( Pack of 1 ),210,65,2.1
Women Clothing,PIYURZ Pack of 6 Poly Cotton Solid Women's Briefs ( Multi Color ),207,74,2.7
Women Clothing,Vkaran Lycra Cut Outs Saree With Unstitched Blouse Piece ( Black ),299,85,3.1
Women Clothing,Laadli Maroon Readymade without Pad Cotton Blend Women's Blouse ( Pack of 1 ),210,65,3.2
Women Clothing,DOOZIE LOVEPLUS Pack of 6 Poly Cotton Printed Women's Hipster ( Multicolor ),204,80,2.7
Women Clothing,Fasanger Women's Printed Cotton Blend Dungarees ( Yellow ),319,87,2.4
Women Clothing,ALTECIA Women Net Indo-Western Semi Stitched Lehenga Choli ( Black ),468,33,3.3
Women Clothing,Rajnandini Unstitched Cotton Blend Printed Dress Material - Multicolor 8 ( Pack of 1 ),363,82,2.4
Women Clothing,Lecowar Women Fleece Hooded Sweatshirt For ( Maroon ),424,78,4.5
Women Clothing,color bucket Women Net Circular Semi Stitched Lehenga Choli ( Beige ),377,81,2.8
Women Clothing,Vibhagyaa Georgette Printed Saree With Unstitched Blouse Piece ( Black ),251,75,3.7
Women Clothing,FIHA Womens Fishnet Bodystocking Crotchless Bodysuit Tights Soft Nightwear Lingerie,276,61,3.1
Women Clothing,Parona Women Fleece Hooded Sweatshirt For ( Black ),457,76,2.7
Women Clothing,PuriMaa White Organza Circular Semi Stitched Lehenga,765,74,3.2
Women Clothing,Jivandhara Women Regular Jacket ( White ),262,74,4.3
Women Clothing,"BLYNK Lycra Petticoat ( Multicoloured , )",268,82,4.5
Women Clothing,"N-Gal Lycra Petticoat ( Black , )",248,81,3.4
Women Clothing,POPWINGS Polyester Blend Women's Shrugs - Purple ( Single ),491,75,4.0
Women Clothing,COMFY ATTIRE White Cotton Women's Flared Skirt ( Pack of 1 ),416,68,2.8
Women Clothing,Laadli Black Readymade without Pad Cotton Blend Women's Blouse ( Pack of 1 ),210,65,2.9
Women Clothing,"Ladyland Cotton Hipster ( Multicolor , Pack of 3 )",157,88,3.1
Women Clothing,Kashtbhanjan Women Art Silk Straight Cut Unstitched Lehenga Choli ( Blue ),514,74,2.9
Women Clothing,Lecowar Women Fleece Hooded Sweatshirt For ( Black ),424,78,3.0
Women Clothing,PuriMaa Blue Organza Circular Semi Stitched Lehenga,765,74,2.9
Women Clothing,Lecowar Women Fleece Hooded Sweatshirt For ( Maroon ),424,78,2.8
Women Clothing,color bucket Blue Net Circular Semi Stitched Lehenga Single,377,81,2.4
Women Clothing,Jyoti Traders Women Regular Jacket ( Black ),400,60,4.4
Women Clothing,THAWE PARIDHAN Women Cotton Blend Printed Oversized Fit Round Neck T-Shirt ( White ),224,78,3.3
Women Clothing,YUGAVEERAA Lycra Solid Regular Saree With Unstitched Blouse Piece ( Blue ),299,66,2.6
Women Clothing,RIYA ENTERPRISE Chiffon Solid Regular Saree With Unstitched Blouse Piece ( Gold ),404,69,4.2
Women Clothing,Mercel Brown Polyester Women's Nightwear Night Dress ( Pack of 1 ),215,85,4.6
Women Clothing,ATIMUNA Gold Polyester Women Baby Doll Dress With Panty,282,72,4.5
Women Clothing,"kramox pack of 2 (72 pcs) trips Double Sided Tape for Fashion, Clothing and Body | All Day Strength Invisible Dress Tape for women | Gentle to stick on Skin and clothes | Transparent",126,84,3.7
Women Clothing,FIHA Womens Fishnet Bodystocking Crotchless Bodysuit Tights Soft Nightwear Lingerie,276,61,3.5
